{
  "agent": {
    "name": "bookkeeper"
  },
  "ended_at": "2023-11-14T22:13:25Z",
  "events": [
    {
      "at": "2023-11-14T22:13:20Z",
      "content": "You are a bookkeeper.",
      "role": "system",
      "seq": 1,
      "type": "message"
    },
    {
      "at": "2023-11-14T22:13:20Z",
      "content": "What is the cash balance?",
      "role": "user",
      "seq": 2,
      "type": "message"
    },
    {
      "arguments": {
        "account": "cash"
      },
      "at": "2023-11-14T22:13:21Z",
      "call_id": "call_1",
      "seq": 3,
      "tool": "balance",
      "type": "tool_call"
    },
    {
      "at": "2023-11-14T22:13:21.200000Z",
      "call_id": "call_1",
      "ok": true,
      "result": {
        "balance": "5",
        "ok": true
      },
      "seq": 4,
      "type": "tool_result"
    },
    {
      "at": "2023-11-14T22:13:23Z",
      "content": "Cash is 5 USD.",
      "role": "assistant",
      "seq": 5,
      "type": "message"
    }
  ],
  "metadata": {
    "otel.agents": "1",
    "otel.resource_schema_urls": "absent",
    "otel.scope": "acme.instrumentation 0.3.0",
    "otel.scope_schema_url": "absent",
    "otel.semconv": "1.37",
    "otel.spans": "4"
  },
  "schema_version": "1",
  "started_at": "2023-11-14T22:13:20Z",
  "trace_id": "0af7651916cd43dd8448eb211c80319c"
}
